{
  "schemaVersion": "1.0.0",
  "catalogVersion": "2026-10-03",
  "publishedAt": "2026-10-03T00:00:00Z",
  "source": {
    "repository": "https://github.com/0125joel/PIM-Monitor",
    "path": "docs-site/src/data/eam-role-catalog.json"
  },
  "roles": [
    {
      "templateId": "db506228-d27e-4b7d-95e5-295956d6615f",
      "displayName": "Agent ID Administrator",
      "plane": "Control",
      "securityLevel": "Privileged",
      "isPrivileged": true,
      "expectedConfig": {
        "maxActivationDuration": "PT1H",
        "requireMFA": true,
        "authContext": "phish-resistant-sif",
        "requireJustification": true,
        "requireApproval": true
      },
      "note": null,
      "reviewNeeded": false
    },
    {
      "templateId": "adb2368d-a9be-41b5-8667-d96778e081b0",
      "displayName": "Agent ID Developer",
      "plane": "Control",
      "securityLevel": "Specialized",
      "isPrivileged": false,
      "expectedConfig": {
        "maxActivationDuration": "PT4H",
        "requireMFA": true,
        "authContext": "phish-resistant-no-sif",
        "requireJustification": true,
        "requireApproval": true
      },
      "note": "Creates agent identity blueprints and service principals and owns them. Writing identity principals is a Control-plane action with real blast radius, so Specialized rather than Enterprise.",
      "reviewNeeded": false
    },
    {
      "templateId": "6b942400-691f-4bf0-9d12-d8a254a2baf5",
      "displayName": "Agent Registry Administrator",
      "plane": "Control",
      "securityLevel": "Specialized",
      "isPrivileged": false,
      "expectedConfig": {
        "maxActivationDuration": "PT4H",
        "requireMFA": true,
        "authContext": "phish-resistant-no-sif",
        "requireJustification": true,
        "requireApproval": true
      },
      "note": "Full administration of the agent registry, which governs agent identities, is a Control-plane write, so Specialized rather than Enterprise.",
      "reviewNeeded": false
    },
    {
      "templateId": "d2562ede-74db-457e-a7b6-544e236ebb61",
      "displayName": "AI Administrator",
      "plane": "Management",
      "securityLevel": "Privileged",
      "isPrivileged": true,
      "expectedConfig": {
        "maxActivationDuration": "PT1H",
        "requireMFA": true,
        "authContext": "phish-resistant-sif",
        "requireJustification": true,
        "requireApproval": true
      },
      "note": null,
      "reviewNeeded": false
    },
    {
      "templateId": "1fe13547-53f6-408d-ac04-7f8eed167b38",
      "displayName": "AI Reader",
      "plane": "Data",
      "securityLevel": "Privileged",
      "isPrivileged": true,
      "expectedConfig": {
        "maxActivationDuration": "PT1H",
        "requireMFA": true,
        "authContext": "phish-resistant-sif",
        "requireJustification": true,
        "requireApproval": true
      },
      "note": "Read-only data role, but Microsoft flags it isPrivileged, so the floor forces Privileged.",
      "reviewNeeded": false
    },
    {
      "templateId": "9b895d92-2cd3-44c7-9d02-a6ac2d5ea5c3",
      "displayName": "Application Administrator",
      "plane": "Control",
      "securityLevel": "Privileged",
      "isPrivileged": true,
      "expectedConfig": {
        "maxActivationDuration": "PT1H",
        "requireMFA": true,
        "authContext": "phish-resistant-sif",
        "requireJustification": true,
        "requireApproval": true
      },
      "note": null,
      "reviewNeeded": false
    },
    {
      "templateId": "cf1c38e5-3621-4004-a7cb-879624dced7c",
      "displayName": "Application Developer",
      "plane": "Control",
      "securityLevel": "Privileged",
      "isPrivileged": true,
      "expectedConfig": {
        "maxActivationDuration": "PT1H",
        "requireMFA": true,
        "authContext": "phish-resistant-sif",
        "requireJustification": true,
        "requireApproval": true
      },
      "note": null,
      "reviewNeeded": false
    },
    {
      "templateId": "9c6df0f2-1e7c-4dc3-b195-66dfbd24aa8f",
      "displayName": "Attack Payload Author",
      "plane": "Management",
      "securityLevel": "Specialized",
      "isPrivileged": false,
      "expectedConfig": {
        "maxActivationDuration": "PT4H",
        "requireMFA": true,
        "authContext": "phish-resistant-no-sif",
        "requireJustification": true,
        "requireApproval": true
      },
      "note": null,
      "reviewNeeded": false
    },
    {
      "templateId": "c430b396-e693-46cc-96f3-db01bf8bb62a",
      "displayName": "Attack Simulation Administrator",
      "plane": "Management",
      "securityLevel": "Specialized",
      "isPrivileged": false,
      "expectedConfig": {
        "maxActivationDuration": "PT4H",
        "requireMFA": true,
        "authContext": "phish-resistant-no-sif",
        "requireJustification": true,
        "requireApproval": true
      },
      "note": null,
      "reviewNeeded": false
    },
    {
      "templateId": "58a13ea3-c632-46ae-9ee0-9c0d43cd7f3d",
      "displayName": "Attribute Assignment Administrator",
      "plane": "Control",
      "securityLevel": "Specialized",
      "isPrivileged": false,
      "expectedConfig": {
        "maxActivationDuration": "PT4H",
        "requireMFA": true,
        "authContext": "phish-resistant-no-sif",
        "requireJustification": true,
        "requireApproval": true
      },
      "note": null,
      "reviewNeeded": false
    },
    {
      "templateId": "ffd52fa5-98dc-465c-991d-fc073eb59f8f",
      "displayName": "Attribute Assignment Reader",
      "plane": "Control",
      "securityLevel": "Enterprise",
      "isPrivileged": false,
      "expectedConfig": {
        "maxActivationDuration": "PT8H",
        "requireMFA": true,
        "requireJustification": true,
        "requireApproval": false
      },
      "note": null,
      "reviewNeeded": false
    },
    {
      "templateId": "8424c6f0-a189-499e-bbd0-26c1753c96d4",
      "displayName": "Attribute Definition Administrator",
      "plane": "Control",
      "securityLevel": "Specialized",
      "isPrivileged": false,
      "expectedConfig": {
        "maxActivationDuration": "PT4H",
        "requireMFA": true,
        "authContext": "phish-resistant-no-sif",
        "requireJustification": true,
        "requireApproval": true
      },
      "note": "Defines custom security attribute sets and definitions, the schema behind attribute-based access. That security-configuration write makes it Specialized, not Enterprise.",
      "reviewNeeded": false
    },
    {
      "templateId": "1d336d2c-4ae8-42ef-9711-b3604ce3fc2c",
      "displayName": "Attribute Definition Reader",
      "plane": "Control",
      "securityLevel": "Enterprise",
      "isPrivileged": false,
      "expectedConfig": {
        "maxActivationDuration": "PT8H",
        "requireMFA": true,
        "requireJustification": true,
        "requireApproval": false
      },
      "note": null,
      "reviewNeeded": false
    },
    {
      "templateId": "5b784334-f94b-471a-a387-e7219fc49ca2",
      "displayName": "Attribute Log Administrator",
      "plane": "Control",
      "securityLevel": "Enterprise",
      "isPrivileged": false,
      "expectedConfig": {
        "maxActivationDuration": "PT8H",
        "requireMFA": true,
        "requireJustification": true,
        "requireApproval": false
      },
      "note": null,
      "reviewNeeded": false
    },
    {
      "templateId": "9c99539d-8186-4804-835f-fd51ef9e2dcd",
      "displayName": "Attribute Log Reader",
      "plane": "Control",
      "securityLevel": "Enterprise",
      "isPrivileged": false,
      "expectedConfig": {
        "maxActivationDuration": "PT8H",
        "requireMFA": true,
        "requireJustification": true,
        "requireApproval": false
      },
      "note": null,
      "reviewNeeded": false
    },
    {
      "templateId": "ecb2c6bf-0ab6-418e-bd87-7986f8d63bbe",
      "displayName": "Attribute Provisioning Administrator",
      "plane": "Control",
      "securityLevel": "Privileged",
      "isPrivileged": true,
      "expectedConfig": {
        "maxActivationDuration": "PT1H",
        "requireMFA": true,
        "authContext": "phish-resistant-sif",
        "requireJustification": true,
        "requireApproval": true
      },
      "note": null,
      "reviewNeeded": false
    },
    {
      "templateId": "422218e4-db15-4ef9-bbe0-8afb41546d79",
      "displayName": "Attribute Provisioning Reader",
      "plane": "Control",
      "securityLevel": "Privileged",
      "isPrivileged": true,
      "expectedConfig": {
        "maxActivationDuration": "PT1H",
        "requireMFA": true,
        "authContext": "phish-resistant-sif",
        "requireJustification": true,
        "requireApproval": true
      },
      "note": "Read-only, but isPrivileged: it reads provisioning configuration on service principals, so the floor forces Privileged.",
      "reviewNeeded": false
    },
    {
      "templateId": "c4e39bd9-1100-46d3-8c65-fb160da0071f",
      "displayName": "Authentication Administrator",
      "plane": "Control",
      "securityLevel": "Privileged",
      "isPrivileged": true,
      "expectedConfig": {
        "maxActivationDuration": "PT1H",
        "requireMFA": true,
        "authContext": "phish-resistant-sif",
        "requireJustification": true,
        "requireApproval": true
      },
      "note": null,
      "reviewNeeded": false
    },
    {
      "templateId": "25a516ed-2fa0-40ea-a2d0-12923a21473a",
      "displayName": "Authentication Extensibility Administrator",
      "plane": "Control",
      "securityLevel": "Privileged",
      "isPrivileged": true,
      "expectedConfig": {
        "maxActivationDuration": "PT1H",
        "requireMFA": true,
        "authContext": "phish-resistant-sif",
        "requireJustification": true,
        "requireApproval": true
      },
      "note": null,
      "reviewNeeded": false
    },
    {